{
  "run_id": "omp-1792273232-866e7935",
  "host": "omp",
  "host_version": "omp/18.11.2",
  "timestamp": "2026-10-17T21:40:35Z",
  "overall_verdict": "UNTESTED",
  "planes": {
    "canonical": "PASS",
    "adapter": "PASS",
    "package": "PASS",
    "runtime": "UNTESTED"
  },
  "surface_revisions": {
    "canonical_pin": "1dcc2bacde73ddd284803b7af28164d0436198fc",
    "upstream_head": "1dcc2bacde73ddd284803b7af28164d0436198fc",
    "spec_hash": "f403a35e9ce91413047544cd3cbfc1bba3baf9d56bd90a2e3863432d3fc5bf63",
    "skills_tree_hash": "485ef2ec4e7d4893e3598b568b079f9e044c88dbedde409c10d4e8dc64a77051",
    "profile_hash": "24ff0dd0e08c0c19b20f27554963cb09eba4c313601a1dcccf868694626e86b8",
    "package_descriptor_hash": "52cc6b3ce9b87a80f783362b109cb7b5a6190e7f26d25687b6b2a16f3651a647",
    "manifest_hash": "0796214ef5886c4763eaf83963145785e0cc363252671b3f4399eb0d8cb7ed06",
    "driver_revision": "197056fd5d4d19028a1bc3e13aded99c40832baa28699392e87eef24f556348c",
    "package_driver_revision": "54ce43e8bd06c0aea5f99adb79d6b54df003176156e902f6a734ad752a1bc8a0",
    "boundary_driver_revision": "cfdeff9eff942593c47123a9a5e1cbf0d59d35f8b7688058a64d282a414f7353"
  },
  "scenarios": [
    {
      "id": "doctor-canonical-index",
      "description": "Verify canonical inventory conforms to pin",
      "plane": "canonical",
      "command": "/home/tommyk/projects/pstack/.venv/bin/python /home/tommyk/projects/pstack/scripts/canonical-index.py --check",
      "exit_code": 0,
      "stdout_snippet": "Conformance: PASS\nFreshness: DRIFT (49 commits ahead)\nPrinciples: 24 | Playbooks: 23\nArtifacts: 167 (preserved=93, adapted=64, excluded=10, gaps=0)\nPASS: Canonical inventory conforms to pin.",
      "verdict": "PASS",
      "duration_s": 0.102,
      "evidence_level": "offline",
      "settlement": null,
      "preserved_from": ""
    },
    {
      "id": "doctor-openspec-validation",
      "description": "Verify 2026-10-15-harness-neutral-role-policy openspec change passes schema checks",
      "plane": "canonical",
      "command": "/home/tommyk/projects/pstack/.venv/bin/python -c import importlib.util, sys; spec = importlib.util.spec_from_file_location('vp_helper', 'scripts/verify-portable.py'); m = importlib.util.module_from_spec(spec); spec.loader.exec_module(m); sys.exit(m.validate_openspec_change(sys.argv[1])) 2026-10-15-harness-neutral-role-policy",
      "exit_code": 0,
      "stdout_snippet": "Change '2026-10-15-harness-neutral-role-policy' is valid",
      "verdict": "PASS",
      "duration_s": 0.685,
      "evidence_level": "offline",
      "settlement": null,
      "preserved_from": ""
    },
    {
      "id": "doctor-adapter-static",
      "description": "Verify static harness names and discipline",
      "plane": "adapter",
      "command": "/home/tommyk/projects/pstack/.venv/bin/python /home/tommyk/projects/pstack/scripts/verify-harness.py",
      "exit_code": 0,
      "stdout_snippet": "PASS\nplaybooks: 22 named + opening-a-pr\nprinciples: 24\nplugin.json name: pstack",
      "verdict": "PASS",
      "duration_s": 1.488,
      "evidence_level": "offline",
      "settlement": null,
      "preserved_from": ""
    },
    {
      "id": "doctor-scan-host-boundary",
      "description": "Verify shared skills and playbooks maintain host-neutral adapter boundary",
      "plane": "adapter",
      "command": "/home/tommyk/projects/pstack/.venv/bin/python /home/tommyk/projects/pstack/scripts/scan-host-boundary.py --check",
      "exit_code": 0,
      "stdout_snippet": "[scan-host-boundary] PASS: Scanned 138 files across portable surfaces. 0 boundary leaks.",
      "verdict": "PASS",
      "duration_s": 0.481,
      "evidence_level": "offline",
      "settlement": null,
      "preserved_from": ""
    },
    {
      "id": "doctor-package-projection",
      "description": "Verify package descriptor and projected native harness manifests",
      "plane": "package",
      "command": "/home/tommyk/projects/pstack/.venv/bin/python /home/tommyk/projects/pstack/scripts/project-package.py --check",
      "exit_code": 0,
      "stdout_snippet": "PASS: grok manifest at .grok-plugin/plugin.json in sync\nPASS: codex manifest at .codex-plugin/plugin.json in sync\nPASS: codex models at .codex-plugin/models.json in sync\nPASS: omp manifest at .omp-plugin/package.json in sync\nPASS: opencode manifest at .opencode-plugin/package.json in sync\nPASS: anti",
      "verdict": "PASS",
      "duration_s": 0.086,
      "evidence_level": "offline",
      "settlement": null,
      "preserved_from": ""
    },
    {
      "id": "doctor-package-lifecycle-omp",
      "description": "Verify native package lifecycle contract for omp",
      "plane": "package",
      "command": "/home/tommyk/projects/pstack/.venv/bin/python /home/tommyk/projects/pstack/scripts/package-lifecycle.py verify --host omp",
      "exit_code": 0,
      "stdout_snippet": "[omp] Executing verify...\nPASS: omp manifest at .omp-plugin/package.json in sync\n[omp] VERIFY PASS",
      "verdict": "PASS",
      "duration_s": 0.076,
      "evidence_level": "offline",
      "settlement": null,
      "preserved_from": ""
    },
    {
      "id": "doctor-profile-omp",
      "description": "Validate typed harness profile for omp",
      "plane": "adapter",
      "command": "/home/tommyk/projects/pstack/.venv/bin/python -c import json; from pathlib import Path; from scripts.portability_schema import HarnessProfile, Binding, Evidence; d = json.loads(Path('/home/tommyk/projects/pstack/profiles/omp.json').read_text()); b = [Binding(**x) for x in d.get('bindings', [])]; e = [Evidence(**x) for x in d.get('evidence_ledger', [])]; HarnessProfile(host=d['host'], support_state=d['support_state'], bindings=b, skills_dir=d.get('skills_dir'), plugins_dir=d.get('plugins_dir'), plugin_manifest=d.get('plugin_manifest'), evidence_ledger=e, tool_mappings=d.get('tool_mappings'), skill_order=d.get('skill_order'), runtime_conventions=d.get('runtime_conventions')).validate()",
      "exit_code": 0,
      "stdout_snippet": "",
      "verdict": "PASS",
      "duration_s": 0.062,
      "evidence_level": "offline",
      "settlement": null,
      "preserved_from": ""
    }
  ],
  "artifacts": [
    "/home/tommyk/projects/pstack/.audit/evidence/omp-1792273232-866e7935/receipt.json",
    ".audit/evidence/omp-receipt.json"
  ],
  "claim": "omp 5-harness portability conformance verification",
  "kind": "runtime"
}
